,review,sentiment
475,Very mild spoiler basic plot outline real detail IF go movie sufficiently low expectation I saw film free screening few day ago Maryland reason I agreed go because free I expected few chuckle I never huge fan Tenacious D much The first ten minute film hilarious we given look Jack Black humble Christian origin Midwest American town The film take u year future first meeting JB Kyle Gass second half Tenacious D We see formation the band the genesis it name Finally the title suggests the second half the film detail quest obtain the fabled Pick Destiny Again the beginning the film laugh loud funny most the movie least kept smile my face That said were time felt bit long minute still felt like should been bit shorter The story every bit absurd a sound this not film see want real plot Which fine except mean many the joke very hit miss when miss miss bad Same thing the song is musical many the song lost appeal the first minute then kept going anyway I say the R rating really saved this movie bombing The D s humor simply t work without cussing sex drug reference But unless re a real fan the band at the very least know appreciate style comedy I would recommend save some money rent Pick make you giggle a bit is worth buck I t think so I wa tempted rate a since I think many would enjoy enough justify seeing it in theatre a seems appropriate Just sure it s style,positive
476,I shall begin disclaimer This movie NOT recommended anyone lack interest never played FF game watching The movie relies audience knowledge character game convey story plot element And doe very subtly Do homework watching wonderful piece CG film I promise ll much better With mind film some spectacular CG sequence I have ever witnessed The whole experience felt like extra long FMV sequence game steroid Yeah The attention detail each scene especially heavy action oriented one impeccable left sense awe I believe soundtrack simplified so help audience focus animation quality than music Again are familiar FF story background music surprise anyone although timing placement each soundtrack original accompany each scene mood the point the music simply enhances the animation Once I having played FF thoroughly enjoyed piece art Square Enix And is the feel most scene choreographed organized Like dance In short enjoyed the music the game Final Fantasy film blow out the water If re the unfortunate majority not experienced the goodness known a FF Playstation PC so watching the movie allow an exponentially greater experience Finally I want make note the quality animating film Characters move with fluidity Each scene background come life tell own story For those who criticize the thinness dependency the story plot I urge you reexamine the animation Facial reaction subtle clue bring another level entertainment the typical narration method story plot delivery Square Enix the great Tetsuya Nomura set a new bar quality animation storytelling Advent Children ha ushered a new era CG animation allowing the subtlety that lie each character to speak volume in and themselves Thanks Square Enix The wait well worth,positive
477,This quite possibly one worst movie ever made Everything acting directing script cinematography dreadful The alien human sparkly suit claim nearby universe one assumes scriptwriter meant galaxy didn bother get dictionary check term A better title film would be It Came From Planet Plot Contrivances The plot excessively silly nearly nonexistent The human given magical MacGuffins conform tortuous series unlikely restriction move bare plot Any thought to passage time ignored Now s a couple day meeting the alien BAM all a sudden s a couple hour left zero hour Do a favor miss movie You make stupider having watched The ending particularly silly should been accompanied someone going Ta Da the scriptwriter pull something random of butt I think the real alien plot that movie suck bad ll get cancer watching it If can watch the last minute without crapping enemy of freedom honestly laughing re retarded,negative
478,If really really REALLY enjoy movie featuring ant building dirt mirror eating non ant conquering world voice narrative movie Basically couple scientist working bio dome communicate highly intelligent ant most intelligent actor this film an attempt try thwart plan conquest extermination Throughout movie two scientist girl rescued ant use everything their disposal computer green dye horrid acting avail I guess just afford pesticide movie would over quickly The title movie Phase IV something mystery This a spoiler Phase I start right opening credit whereas you don t reach Phase IV end credit roll Apparently director knew the movie would tedious get placed Phases throughout the movie a kind of progress report Hang there buddy Only phase final credit As a MST K episode this one t good two reason This one from the Season KTMA they first starting so the riffing not good in later season and This movie so bad not even J TB lighten up There one two Gamera reference they just finished riffing Gamera movie The movie have a trick surprise ending I so glad to reach the end the effect lost me,negative
479,Joseph Brady Clarence Doolittle two sailor have four day shore leave Hollywood Joe know everything girl can wait see Lola Clarence shyer need advice buddy how meet girl They run little boy Donald Martin ha ran away order join navy They take home meet beautiful aunt Susan want be singer Clarence want Susie be girl his shyness get way But doesn feel shy waitress come Brooklyn like Soon Joe notice love Susie The boy a fix lie Susie meeting a big time music producer don even know As they are a fix their feeling George Sidney Anchors Aweigh a great musical comedy Gene Kelly top notch again his singing dancing routine Frank Sinatra terrific shy guy Brooklyn Shy t first thing come mind you think Frank Sinatra he play his part well Kathryn Grayson fantastic Susan Abbott We sadly lost gifted actress operatic soprano singer last month age The year old Dean Stockwell amazing job the little fellow wanting become a sailor Jose Iturbi great job performing It magic he doe the piano Edgar Kennedy play Chief police station Sara Berner the voice Jerry Mouse There a lot great stuff in this movie some fantastic singing dancing number Just look Kelly Sinatra performing We Hate Leave It so energetic If You Knew Susie Like I Know Susie quite funny It a nice moment Frank sings Brahms Lullaby little Dean Stockwell It s lovely listen Grayson singing the tango Jealousy The memorable sequence the one take the animated fantasy world Gene sings dance with Jerry Mouse Also Tom Cat seen there a the butler They originally asked Mickey Mouse he refused The movie nominated five Oscars Georgie Stoll got one Original Music Score Anchors Aweigh some high class entertainment,positive
480,From director Barbet Schroder Reversal Fortune I think I saw bit this my Media Studies class I recognised leading actress I tried despite rating critic Basically cool kid Richard Haywood Half Nelson Ryan Gosling Justin Pendleton Bully Michael Pitt team murder random girl challenge see get away without police finding Investigating the murder homicide detective Cassie The Hyena Mayweather Sandra Bullock new partner Sam Kennedy Ben Chaplin are pretty baffled the evidence found the scene e g non relating hair The plan t seem to be completely going well Cassie Sam quite quickly Richard Justin suspect is question if they sway away Also starring Agnes Bruckner Lisa Mills Chris Penn Ray Feathers R D Call Captain Rod Cody Tom Verica Asst D A Al Swanson I see the concept Sir Alfred Hitchcock Rope the murdering a challenge thing this film it a silly way not even a reasonably good Bullock can save it from dull and predictable Adequate,negative
481,Things Come early Sci Fi film show an imagined world Everytown year You break up different scene part The film span mainly how ruler Boss wanted get capability fly airplane after Everytown bombed war broke This film ha fault audio muddy video some quirk the character t deep all the overall plot t altogether solid The plot lacking something I t put finger it seems little fluffy But you love sci fi are interested what H G Wells though might happened the next hundred year is must see It s worth seeing learn what everyone fearing long drawn war they just about go to war Germany there a threat biological weapon everything Things to Come is a pretty good movie most people need to see,positive
482,Weak stale tired cliched want be Basic Instinct miss opportunity opportunity fresh perspective new insight Insipid trite grotesque without possibly redeeming value brevity oh wait wa minute long must just seemed lot longer I rather clean bus station toilet my toothbrush have sit I expressing opinion I guess this mean I t like,negative
483,One word describe movie that weird I recorded movie one day Japanese animation old I thought it would interesting Well it wa movie about young boy travel universe get a metal body seek revenge On way he meet colorful character must ultimately decide he want body not Very strange a fan animation science fiction you might want check out,positive
484,While video store browsing one dollar rental came upon little gem I t know but gut instic about it wow wa i ever right The story center around two girl have survived school shooting One girl Alicia teenage reble witness the full attack another Deanna another survivor survived bullet the head some miracle Thrown together fate slowly begin a painful beautiful display healing moving I just hate it when amazing movie fall the crack Because wow a performance Busy Phillips Erkia Christensen to mention the rest the cast My only complaint is that the DVD wa sorely lacking special feature Oh some the jump cut the movie kind jarring But in a excellent movie,positive
485,film quite simply one worst film ever made damning indictment not British film industry talentless hack work today Not did film get mainstream distribution also feature good cast British actor went wrong don know simply don care enough engage debate the film terrible deserves thought all warned stay the hell away this rubbish apparently need write ten line text this review so might well detail the plot A nob man is setup evil friend co worker his father company thus lead an encounter the Russian mafia dodgy accent stupid stupid plot twist device i should asked my money back wa perhaps still shock the experience you want a good crime film watch the usual suspect the godfather what about lock stock thats the peak of the contemporary British crime film,negative
486,I not comment lot Stereotype character absolute ignorance Colombia s reality awful mise en scene poor color choice NOT funny supposed be comedy expect laugh some distend music s beside nonsense scene Very poor actor direction you see somewhere people I mean interpreter you ll know they are least good seeing call film is impossible guess you get tired music comedy no rhythm only good rhythm s the rap sing the final credit pathetic t it etc etc It been long time I t seen movie so bad,negative
487,This movie riot I remember last time I such great time movie I seen few good comedy my time usually pretty funny But one wall wall great line I think Best Show last movie I laughed hard much The movie non stop end minute sentimental plot clean Other constant barrage one liner goofy situation I like see again leaf theater like Zucker movie get joke first time around You see two three time get As far the actual film go could used better edit choppy time we forgiving All the character great It s not like Adam Sandler movie he try be funny everyone else suffers around the butt the joke I think I remember the main character year to come are all so likable No victim this movie Also thank God got year old actress to play girlfriend Catherine Keener play sweetheart this film You wish that woman like really existed She s not a like the other leading lady somehow smile is warmer Julia Roberts overdone overbite If see the trailer this film may not think highly it I assure the trailer not it justice They not give away all the good joke Just the mediocre one Oh and one thing I hope critic put this on top ten list Many of them complain that comedy t get the recognition they deserve and then the end of the year they don t put it on list This mean you Ebert,positive
488,A fey story Martian attempt colonize Earth Things must pretty bad back Mars Two state trooper investigate scene reported UFO crash Whatever landed buried ice Tracy Pond footstep snow leading nearby diner The diner had customer since eleven clock morning Now handful bus passenger sitting around waiting permission cross structurally weak bridge The bus driver insists six passenger aboard bus although didn notice they The problem there SEVEN people waiting journey resumed One them an alien which one All them are suspect There crazy old man Jack Elam course seems exercise sub rosa wit There blustering businessman must get Boston John Hoyt A young couple their honeymoon Execrable performance husband Ron Kipling Except the couple nobody noticed anyone else And even the couple are suspicious each Bride newly minted husband I could sworn had a mole your chin The story continues a sprightly slightly spooky way the phone ring no reason the light go the juke box turn none be taken seriously It a thoroughly enjoyable ensemble play the climactic revelation worth a chuckle There no discernible depth It not a moral message pod people masquerading normal citizen It not a warning any kind a fairy tale diverts amuses I always enjoy it when it on It especially interesting to see John Hoyt the irritable and impatient businessman knowing that wa the Roman Senator masterminded the assassination Julius Caesar in MGM version Shakespeare s play And he with three arm Oops,positive
489,It rare I feel need write review site film very deserving poorly created how bias product I felt distinct attempt part film maker display Palestinian family boorish untrustworthy We hear discus sadness they feel oppression yet film shot arranged way we feel politically oppressed population Jewish Israeli population We see evidence parallel position Palestinian teenager We hear other Palestinians prison I understand restriction place political nature restriction designed prevent peace I came film feeling mother victim wa selfish her mourning completely closed minded due her side the fence speak She continued unwilling see the hurt the bomber parent her angry closed minded word caused the final meeting spiral control It more realistic my mind see the Israeli mindset be root the problem ignored plea understanding freedom ignored request acknowledgment the process the Jewish population acquired the land I given this a two selfish weakness the mother which normally would be admirable a documentary however the light the lack impartiality all seems exploitative Also the poor edits lack background the actual instance finally the lack of proper representation of the Palestinian side Ultimately is a poor documentary a poor film I acknowledge this is partially the result of the political situation am obliged to note the flaw in direction regardless of the heart wrenching sad subject matter,negative
490,Relentless like one those loud action movie The entire cast seems be speed I t quite get director intention any I wonder she ever seen Stanley Donen Vincent Minnelli even George Sidney musical Structure please This one hell mess I loved Abba The costume unflattering photography unflattering towards actor loving towards location The one thing make whole thing bearable the sight Meryl Streep making a fool herself No chemistry her friend Christine Baranski Julie Walters think Streep Lily Tomlyn the Altman film you understand I hoping I embarrassed particular Pierce Brosnam Colin Firth The audience however seemed enjoy so probably s me,negative
491,This movie great job explaining problem faced the fear we before we put man space As a history space flight is still used today classroom can get one the rare print Disney shown it on Vault Disney I wish would so,positive
492,In alternate where outbreak undead caused mysterious space dust been contained use special electronic collar young loner Timmy find friend Fido Billy Connelly family recently acquired domesticated zombie Fido quickly becomes surrogate father Timmy whose real dad unable adequately express love son hot trot wife played gorgeous Carrie Anne Moss been psychologically scarred child forced shoot own father tried eat Timmy run a spot bother however his putrid pal collar go blink he attack kill elderly neighbour With authority Fido trail trouble brewing a pair local bully his mother forming a bond their undead house help Timmy able hold his new found friend A refreshing take the whole zombie schtick Fido a thoroughly entertaining deliciously dark comedy should appeal anyone a slightly twisted sense humour Taking the Romero zombie verse transplanting into small town America a stroke genius the result simply one the original film tackle the whole reanimated dead theme I seen Connelly Fido a cinematic zombie worthy inclusion the Undead Movie Hall Fame along Day Of The Dead Bub Return Of The Living Dead Tarman often I feel empathy a walking corpse The Big Yin performance fine I actually found rooting the big blue bag pu The rest the cast also give commendable performance young K Sun Ray Timmy Ms Moss deserving special mention Ray for one so young he put a particularly assured turn Moss she so bloody yummy This is the third zombie film I watched week the others the somewhat disappointing Planet Terror the rather fun Flight Of The Living Dead surprise is also the best Director Andrew Currie given fan the genre something truly original to treasure is a talent to be watched the future of rounded to for IMDb,positive
493,An extremely earth well made acted Rodeo Western No gussied star needed cast member regular people telling real life story rodeo hustler his entourage West But hat particularly Slim Pickens giving I think his signature performance especially given fact he been a rodeo clown real life His role went far beyond mere clown role he deeply dealt all ups down the hard nosed rodeo life the psychological devastation so frequently surround a life style He Mr Coburn teamed extremely well partner only the circuit also the real world outside the corral Also check Anne Archer Coburn Native American love interest the latter part the movie Must been one her first role Not flashy perhaps a Junior Bonner but equally heart rendering and impacting it portrayal Thanks the Encore Western Channel showing true grit an rated movie time to time,positive
494,Despite review distinctly Luke warm I found story totally engrossing even some critic described love story Mills Boon what It good see warm touching story real love these cynical time Many audience sniffing surreptitiously dabbing eye You really believe young Victoria Albert passionately fond each even though political reason arranged marriage I feel though Sir John Conroy wa desperate control young Queen perhaps played like pantomime villain As rumoured he wa fact the real father Victoria result an affair mother The Duchess Kent would been interesting explore theory Emily Blunt is totally convincing the young Princess trapped in the stifling palace courtier politician to manipulate She brilliantly portrays the strength character determination eventually made Victoria a great Queen England prospered never under her long reign I believe word mouth recommendation ensure great success this enjoyable wonderful looking movie,positive
495,American Nightmare officially tied my opinion It Pat WORST MOVIE OF ALL TIME Seven friend oddly resembling K Mart version cast Friends gather coffee shop listen American Nightmare pirate radio show It hosted guy beard That exciting aspect his show Chandler Monica Joey oh wait I mean Wayne Jessie the rest the bad one liner spouting gang take turn revealing biggest fear the bearded DJ Unbeknownst a crazed nurse serial killer listening Crazy Nurse proceeds torture Ross Rachel wait sorry making fear come life These fear include stunner voodoo being gone on by old lady denture No Really This movie in a word rotten Crazy Nurse killing spree lack motivation s nothing make the viewer jump the ending blow again voodoo If have absolutely regard loved one rent American Nightmare them If care your loved one even a little bit go your local Blockbuster rent the copy of American Nightmare hide them in your freezer,negative
496,First I say I loved book Animal Farm I read with th grade class great We also decided watching movie would beneficial The movie so disappointing me The movie cut some character miss lot main point book It skip around lot doesn explain anything detail If someone watching movie without first read book would confused The disappointing thing this movie me ending The ending book powerful the movie changed It supposed be the pig men an alliance sort melting together instead the movie made it seem like the animal going to rebel the pig To sum I t think this movie captured the real meaning Orwell portrayed in his book,negative
497,This movie extremely boring I laughed few time I decided rent when I noticed William Shatner name cover It all this little kid get picked all time classmate When wandering street looking old lady assist meet prostitute She take club called the Playground he befriends several pimp When mayor Tony Gold Shatner decides take the pimp business Lil Pimp must lay for his homies The animation t good this It look like wa made Macromedia I sure wa It t suck s the sort choppy flash animation people gotten used to over recent year The humor this not good I t think of wa funny,negative
498,I disgusted movie No wasn graphic sex scene because ruined image Artemisia Gentileschi This movie hold much truth art It show one piece art work Judith Beheading Holofernese show being entered testimony rape trial she not paint first Judith year the trial I know understood this from the movie probably not Tassi not a noble character He RAPED Artemisia It not love it wa rape He not claim accept false charge rape stop her from suffering she wa tortured According the rape transcript continued claim he never carnally knew Artemisia aka sex while she state again It true I encourage people go and find the real Artemisia and see she really Don base of knowledge this fictional movie I encourage you to research Artemisia really have interesting story behind her and some amazing art work Don t see the movie find the true story of Artemisia,negative
