,review,sentiment
258,Black comedy always easy sell Every you get black comedy hugely successful like Fargo example But usually don t often find big audience People seem either set mind comedy serious mayhem There t seem big market for good mixture both Throw Momma From Train fairly decent hit yet people seem remember much day age Danny DeVito hit this one way park back DeVito play odd mamma boy named Owen looking rid outrageously overbearing unpleasant mother still life The mother played Anne Ramsey passed away shortly this released she quite caricature She loud ugly rude overbearing Though Owen hardly seems like could take care want desperately mother offed He fantasizes some truly weird scene he clearly t gut actually it himself That where Billy Crystal come Crystal play Larry Donner Owen creative writing teacher nearby community college Larry paranoid would intellectual novelist claim ex wife stole novel made million it He currently trying write a new one even come with a decent first sentence The night Owen hears Larry wish ex wife dead an outburst school cafeteria And borrowing the idea Strangers a Train Owen decides travel Hawai murder Larry ex wife Once it appears he done he expects Larry return the favor kill mother The resulting action often quite funny even poignant It certainly never dull often full surprise The acting exceptional even Ramsey a bit the top Crystal good he be DeVito ha always undervalued a performer The film relies quite a bit physical comedy usually work often painfully The film make use some truly innovative editing technique some scene the beat tone truly refreshing I have often critical the late a time artistic malaise and down right lazy film making Throw Momma From the Train take chance Both how character drawn a well a it general plot How many comedy revolve around a son his mother murdered The film t long and it is chock full of laugh Writers apt find it more interesting the general public it can still be enjoyed just about anyone of star The Hound,positive
259,Back I really lengthy vacation around Fourth July something like day row two week paid vacation weekend holiday I stayed town time hanging at parent house lot I t a TV apartment I used watch parent tube I finished watching a segment the X Files a program came called Personal FX I hooked instantly I always fascinated with item our home had come my parent family home through inheritance relative estate often wondered their history value etc After my long vacation I used go my folk house my lunch hour just catch Personal FX I remember one episode which co host Claire Carter announced the New York apartment in which the series filmed being renovated that said renovation complete that Personl FX would return the air It never Personal FX the first best the collectible show And vanished the air Almost fifteen year later I still sore Way to go FX,positive
260,Paul Verhoeven predecessor breakout hit Basic Instinct stylish shocking neo noir thriller Verhoeven become known making somewhat sleazy trash film his native Holland America film one reason The Fourth Man follows strange story Gerard Reve played Jeroen Krabbé gay alcoholic slightly mad writer go Vlissingen give talk story writes While meet seductive Christine Halsslag Renée Soutendijk take back her house he discovers handsome picture one her lover proclaims he meet even kill Paul Verhoeven twist truth many time this film ensures never quite know you Many occurrence The Fourth Man could appear they could easily interpreted something else entirely this keep audience edge their seat duration also make film work this narrative what thrives Paul Verhoeven not filmmaker feel he restrain one thing I like best him This film feature shocking scene made feel ill hour afterwards t happen very often I wont spoil because need surprise element work you see what I mean you see film make sure you get uncut version There also number other macabre scene are le shocking one I mentioned are lovely nonetheless man get eaten lion another one a pipe sent his skull a boat smashed in half lovely The acting in The Fourth Man t anything write home solid throughout Jeroen Krabbé hold the audience attention look the part the drunken writer It Renée Soutendijk that impress the most though the femme fatale the centre the tale Her performance what Sharon Stone would imitate nine year later with Basic Instinct the original fatale best Paul Verhoeven direction is solid throughout he directs attention numerous point view help create the mystery of the story Verhoeven gone make rubbish but he obviously ha talent it a shame that he t put it to better use Of the Verhoeven film I seen this is the best and although it might be difficult to come across trust it s worth the effort,positive
261,I accept most horror t scary today standard hell When see title like this you expect see blood a blood thirsty beast Instead get blood all a beast either want take world live peace Earth yeah what people wanted The overall story is fine astronaut coming back life being one the beast the title really kill the movie Night the Beast would made the fan happy there really t blood speak I like the movie ending left room a sequel wisely never made one This movie t the worst ve ever seen it almost there of,negative
262,Demon Wind about much fun breaking leg It definitely awful example film So awful fact I t even consider movie I describe thing a monstrous thing A thing must stopped all cost My friend I first discovered thing buried a big box video tape my friend house It a late night nothing better do decided watch cheesy horror movie unfortunately picked one Well minute this thing played we ended laughing hard we almost threw The thing literally pointless every sense word It just a cheap poorly done rip Evil Dead The whole story seems be nothing more than guy wanting knock his friend inviting abandoned house letting demon rip piece I a bet the writer actually writing the story being filmed I seen bad horror movie Manos Troll HOBGOBLINS shudder I would to say Demon Wind could definitely contend any all these film term sheer stupidity Watch only you enjoy laughing stupid film Fun fact This film like a cockroach steroid Much like the ouija board every time we try to get rid it it always seems to mysteriously reappear Kind of scary huh,negative
263,There difference film movie A film regardless quality ready public consumption A movie what group friend get together make course weekend camcorder In time viewer I seen may example both On September I attended screening writer director Jon Satejowski Donnybrook Now read script having seen two different cut rough cut finished product piece I safely say movie And student movie It lack better word competent say director knew push record camera capture moving image The visuals most part static unimpressive dialog scene reduced mostly long shot little no close shot allow audience establish relationship character I understand a modestly budgeted film some visual flair would appreciated would gone a long way toward keeping audience interested Granted been independent picture shown limited camera work come well a well written engrossing story some sharp dialog Steven Soderbergh sex lie videotape come immediately mind This movie however neither The main story weak unfocused If main plot Davie trying mend relationship father I feel movie miss point What I got Davie main aspiration change face rock n roll However see little activity his part show While one dream sequence beginning impromptu performance his end seem get scene Davie listening music casually strumming a guitar We simply told Davie played a lot gig we never see full rock mode Next time SHOW TELL audience Anyone ha taken a creative writing class know Also Davie t look like someone would have been big glam rock era look like d be comfortable early day rock n roll posing James Dean le talented brother In meantime rest movie event seem happen random rather cliché character story thread have little nothing slim main story brought abandoned alarming frequency e subplot involving Terry father If I want see a film kind haphazard construction I consider watching Napolean Dynamite a film I could barely make through first time As mentioned dialog scene I guess I mention they few extremely far Is too much ask character speak I t think When the character speak short choppy sentence collection oh insightful question angered grunt wildly the top outburst These character simply do not behave like normal rational people Working material like is easy understand is only one good performance the film Al Hudson because a poor imitation Sam Elliott his time screen A good director at least one is ready the challenge a feature director would have been able spot problem get the writer camera people correct However Satejowski so close the material he simply t see he he is unwilling take the necessary step fix because ll hurt his creative vision Being unable unwilling deal criticism in a constructive manner is the mark a self indulgent misguided fool Just ask Rob Schneider In the end we left a poor high school set knock Zach Braff s amazing Garden State combined the equally amazing Velvet Goldmine two film far worthy time Now the cast crew come the word work take task review allow offer this The best I do is compliment Mr Satejowski for having the ambition make a film his put out there for an audience to see However the hope that this movie be picked and distributed simply deluded vision of grandeur This is a student movie nothing more nothing le If the movie hold any promise and let s face at this point isn t going to come the acting writing directing it is this If IF the people associated this film are willing please learn this movie file it away and use the lesson learned your next attempt t attack your critic have friend or family do it for If you are able to do this maybe the next one be worthy of distribution worthy of being called a film I your audience and I willing to watch,negative
264,please watch series do go see movie trailer completely misleading the weakest character the series stretch badly thought min TV episode the painful hr my life truly awful film tubbs edward few min micky line her lipp reel the tired old pun also mr bris accent change time in the film ton badly acted extra really few laugh they seem recycle for hr honestly feel series been completely ruined this god awful piece crap batman robin is forgiven,negative
265,Finally An Iranian film made Majidi Kiarostami Makhmalbafs This non documentary entertaining black comedy subversive young girl subtly kicking system as It all football it funny it really funny The director say The place real event real so character the extra This why I purposely chose to use professional actor their presence would introduced notion falseness The non actor have rooting them straightaway unless a your heart is made stone b are blind Excellently scripted the film challenge patriarchal authority an almost absurd freshness It won the Jury Grand Prize Berlin Dear reader s near perfect WHERE can I get hold it,positive
266,Sometimes patient watching indie horror If can just toe tap way slow paced early scene sometimes real gem present This unfortunately case Satan Whip Written directed Jason Maran Satan Whip attempt drag u along a boring snore fest a film no real pay at the end I guessing the black white blue cinematography must been a reason however never explained the majority the blood blue I found increasingly annoying the film went The story itself not bad actually some originality decent content the acting is simply pathetic This combined the slow pacing lack any real red gore made Satan Whip one to forget quite quickly I give a rating some witty dialog made chuckle ala could not save boring waste my time,negative
267,Tainted look kibbutz life This film le cultural story boy life kibbutz deliberate demonization kibbutz life general In first two minute movie milk man charge cow rape one calf And downhill there term character representing typical kibbutznikim Besides two main character clinically depressed woman her young son every one else kibbutz gross caricature well evil The story center kibbutz like sort cult slowly drag mother son deeper despair what inevitably follows There happiness joy no laughter kibbutz Every character situation represents different horrific human vice like misogyny hypocrisy violence cultism repression etc For example protagonist strikingly handsome European looking year old boy older brother typical kibbutz youth complete jewish physical appearance brutish personality He care about screwing foreign volunteer health dying mother He treat volunteer like trash After his little brother pleads visit his dying mother seen a long time due his military service order Quote Linda go take shower I cum two minute There one good character this movie a European foreigner play mother boyfriend When animal rapist try hit mother son boyfriend defends breaking rapist arm He summarily kicked kibbutz violent behavior one kibbutz member More hypocrisy The indescribably annoying French woman play the school teacher preaches sex not happen age without love give account the actual act supposed be humorous the audience really stupid She course is screwing the head the kibbutz the field then turn screw the little boy mom her mental health take a turn the worse The film portrays the kibbutz like sort cult Children get yanked bed the middle the night taken some ritual they swear allegiance the field overseen by the kibbutz elder The mother apparently t escape the kibbutz although reality anyone is always free come go they choose It a mystery how the boy father died you rest assured the kibbutz drove him his surviving parent another pair heartless wretched character weigh on the mother her son That s the gist of this movie One dimensional character dramatization dry performance an insidious message keep trying to hammer into the audience s head kibbutz life degrading miserable even deadly those didn t fit I feel sorry for the guy made this film obviously had a bad experience growing in a kibbutz But I feel though he took a few kernel of truth regarding kibbutz life and turned into huge atomic stereotyped bomb,negative
268,When I ever learn The ecstatic reviewer NPR made think turkey another Citizen Kane Please allow vent spleen I admit setting presumably New York City never so downright ugly unappealing I reminded bad decade men fashion automobile And smoking If the plan wa cheapen the character succeeded For film work least my simple estimation ha to be least ONE sympathetic character Only Ned Beaty came close I could wait him to finish Nicky If stray shot struck Mikey well may elicited shrug indifference the I remember I detested film strongly I suppose I a rube doesn t dig art flick Oh well,negative
269,Lost Carnivale Desperate Housewifes list go These bunch other high quality show prof we middle golden age television history Lost pure genius Incredible layer personal psychologically viable story underscored sublime cinematography incredible use word describing TV show a killer score great performance and editing Anyone isn hooked missing one the important creative expression in television ever It may it problem watching one episode a week the DVD format actually incredible way watch this Hope keep up I sure do,positive
270,Clifton Webb one my favorite However Mister Scoutmaster not one his best His patented curmudgeon role seems forced even unpleasant rather funny The film overflowing mawkish sentimentality In addition viewer presented numerous ham handed reference religious faith U S patriotism come reverent rather genuine Clifton Webb his best poor script Edmund Gwenn play yet another jovial clergyman given nothing do The child actor lead played talentless child display flat affect throughout entire film His sole claim fame a a performer evidently is a bullfrog like low voice unusual someone his age However heard you heard you don need hear again Unfortunately is the majority the film scene I find child irritating I fast forward whenever show Since ha a lot scene film mean I fast forward a lot the film There and so many talented child actor s a pity this film t any them it Still Clifton Webb the traditional broad brimmed hat and short is a sight worth seeing,negative
271,This must see documentary movie anyone fear modern youth lost taste real life adventure it sense morality Darius Goes West an amazing roller coaster story We live life Darius crew they embark journey a lifetime Darius Duchenne Muscular Dystrophy a disease affect muscle his body He confined a wheelchair need round clock attention So could crew young friend possibly manage take on a mile round trip West Coast back Watch the movie experience the ups down this great adventure laugh cry the crew they cope unimaginable challenge along the way enjoy the final triumph they arrive back three week later their home town a rapturous reception some great surprise,positive
272,The message world brink war disregarded mass mythical city Everytown represents England general could well stand any nation world When war finally arrive ravage continue another five year until which time Everytown completely destroyed Adding desolation toll humanity wandering sickness pestilence continues another four year Things Come balance fatalistic futuristic world view science hold hope revived civilization The Wings Over World concept play a bit corny though spokesman Cabal Raymond Massey unwavering his mission dedicated his cause If fails others follow This message continually reinforced throughout film brought home convincingly Massey end movie speech Man insatiable need test limit knowledge achievement requires all universe nothing mindset The film imagery automation machinery the second half reminiscent the great silent film Metropolis As Everytown rebuilt transformed the year the spectacle the city rebirth strike a resonant chord architecture modern city today suggest the movie eerily prophetic vision coming fruition Where the movie get it wrong sixty seven year though man s first mission the moon a hundred year timetable probably seemed legitimate Things Come one those rarity film a picture make think Which side you come on the force for advancement in the face uncertainty maintain the status quo It s not a comfortable question a both choice offer inherent danger unknowable outcome Those choose be bystander risk swept away force beyond control,positive
273,Fulci Does man brings one goriest weirdest movie ever made Answer yes Cat Brain also known Nightmare Concert Fulci last masterpiece Yes matter people say There few fact movie one best Fulci movie Fulci make fun his movie one Lead roll movie no then Fulci himself play well horror splatter gore director think slowly going insane It filled black humor unlike modern horror movie work Being Fulci flick need know gory How much Well pretty much I always loved gore movie I never get enough Cat the Brain actually stopped thirst gore believe it hard archive Even the Braindead t stop it CITB gore Almost every scene revolves Fulci who after hypnotized khmmm evil psychiatrist seeing kind horror everything happens everything see Some the scene involves him accidentally dropping the whiskey instead see rotten corpse lying the floor start spit ooze it s wound Forget the Beyond Zombie this IS the goriest Fulci movie Now I like Fulci manage apply all those comic part the gorefest movie He such brilliant director Some funny moment line happens time time like one Fulci say making gore movie kind a sickness Ending is very good considering that Fulci most the Italian horror master is know making ending no sense many plot hole If are fun the Fulci make sure check it If have a weak stomach avoid this repeat Its a movie p some of the gore scene within this movie Chainsaw dismemberment full tongue torn eyeball torn out maggot infested corps zombie decapitation face putted boiling water stab the shower head throat slit many part of the body and organ toast aside hammer smashed face,positive
274,What incomprehensible mess movie Something cop extract bullet himself get shot keep a glass jar bathroom size jar shot fifty time now a top secret tank guarded five six incompetent soldier reason drive into Mexico Whether were sent intentionally just got really really lost never made clear And ll never hear another screenplay feature word butthorn either Gary Busey try Mel Gibson role from Lethal Weapon while Busey a serviceable actor screenplay damn the whole movie mediocrity William Smith another turn a Russian soldier the same character played Red Dawn a few year earlier After playing biker heavy for most the s it sort nice see expand his range playing Communist heavy Sadly he ll probably always remembered best the guy Clint Eastwood whupped in Every Which Way You Can,negative
275,I love watch movie lot scary scene raptor I like raptor they scary My favorite part one raptor look behind the pillar reminds of scene the Friday the th movie the girl eats the banana I really love watch lot of this movie the computer graphic seem little fake okay once get the movie hardly even notice going I think got good ending even though I t really understand wa going on first couple viewing I figured it out time and that s the important part The important part is how scary the dinosaur be you watching it the first time THIS IS BEST MOVIE,positive
276,WARNING REVIEW CONTAINS MILD SPOILERS A couple year back I managed see first five film franchise planning overview whole Elm St series However two year I find I remember enough them order I guess couldn have made much an impression From I do recall sequel Dream Warriors particular t bad often made though even original classic Generally predictability premise people fall asleep get murdered their dream t lend narrative tension But I recall much first five film I do know never plumbed depth Freddy Dead An indication sick Freddy public point judged fact film promoted solely character demise The fact movie conclusion not even hidden fact entire purpose film being go illustrate vacant soulless cynical venture Taking morally questionable idea having child molester charismatic villain Robert Englund way scary interpretation boom laughter I always thought Freddy mockery teenage victim le aimed character teenage audience could ever watch tripe It like Englund cry know garbage paying see one laughing And I sure victim child abuse would be disheartened see an insensitive depiction their plight Was Freddy appearance the film always rudimentary All get do few haaaaaaaaaaaaaarr har har hars If wa the Elm St film d ever seen t get know the character all Even the character pre death flashback Englund play boo hiss pantomime villain slop Transatlantic ie overstated misplaced not all funny irony Acting is almost universally poor Just look at how many time Breckin Meyer overacts hand gesture body language Only Kananga Yaphet Kotto keep dignity And Roseanne Tom Arnold Alice Cooper show you almost visibly see the film sinking the mire The script is absolutely lousy almost wholly without merit Carlos Ricky Dean Logan open road map upon the Noel Coward like Freddy wittily written you re f ked When prompted the map Carlos responds well the map say we re f ked Who wrote the screenplay Oscar Wilde Or how about the scene Carlos is tortured Freddy his hearing enhanced painful level So Freddy torment by threatening drop pin a potentially fatal sound given all sound magnified Oddly the fact Carlos shout at the top his voice him not drop it seems to have no effect Nice hearing you Carlos quip Freddy hoping better line come along It also worth noting dream sleep t occur instaneously so being knocked unconscious wouldn t allow instant access into Freddy world Though a part the narrative contains a human computer game a D finale plot logic t that high the list requirement The teenager heading the cast this time really the most obnoxious dislikeable group in the whole series Tracy Lezlie Deane is the only one get to greet Freddy shut the f k man and a kick in the scallop And wa incongruous pop music always part of the ingredient Freddy s Dead No laugh No scare No interest No fun,negative
277,Some comment IMDb likened Dog Bite Dog classic Cat III film but although undoubtedly brutal violent very downbeat film Pou Soi Cheang t really sleazy lurid sensationalist enough earn comparison However still pack punch make worth watch particularly gritty hard edged action your thing Edison Chen play Pang Cambodian hit man travel Hong Kong assassinate wife judge Sam Lee Wai ruthless cop is determined track down whatever cost With Wai closing target Pang stop nothing ensure escape he meet Yue pretty illegal immigrant need help escape life abuse A relentlessly harsh drama great cinematography amazing sound design haunting score solid performance Chen Lee well newcomer Pei Pei Pang love interest Dog Bite Dog is one fan hard hitting Asian hyper violence think along the line Chan wook Park Vengeance trilogy Stabbings shooting merciless beating happen regularly film caught unflinchingly director Cheang Of course is the kind tale is destined unhappy ending all involved sure enough pretty much everyone this film dy rather nasty death Unfortunately is fine line tragedy unintentional comedy final moment Dog Bite Dog cross in laughably dramatic final scene Pang Wai are locked in battle pregnant Yue look on Eventually all three have suffered severe stab wound the fracas wounded Pang performs a DIY Ceasarean on a dead Yue delivering baby moment he dy Whilst this film might be a classic slice Hong Kong excess it deliriously OTT action stylish visuals s still worth seeking,positive
