,review,sentiment
700,Unfortunately only spoiler review nothing spoil that movie Even B Mattei never done master piece use do job a bit humor craziness that made a fun Eurotrash director But last year seemed have lost This film empty nothing all wake u from deep sleep sink after the first min No sex blood suppose be snuff actor dialog just bad an T V film It even worse his last cannibal zombie epic So Rest peace Bruno will stay our mind forever anyway thanks such unforgettable gem a Zombi Robowar Rats l altro inferno Virus Cruel jaw few others So except you want see B Mattei possessed jess Franco spirit s new film pas this one But you t know this nice artisan s career track his old film have fun,negative
701,I Enjoyed Watching This Well Acted Movie Very Much It Was Well Acted Particularly By Actress Helen Hunt And Actors Steven Weber And Jeff Fahey It Was A Very Interesting Movie Filled With Drama And Suspense From The Beginning To The Very End I Reccomend That Everyone Take The Time To Watch This Made For Television Movie It Is Excellent And Has Great Acting,positive
702,Hypothetical situation abound one time director Harry Ralston give u ultimate post apocalyptic glimpse world dead left street store throughout landscape sans middle forgotten desert One lone survivor attempting rekindle sanity take food city bungalow desert All alone hope nobody around left white underwear passion local Indian tribe discovery camera open new door break barrier human co existence Alan man book left Earth an unknown disaster Thinking alone begin living life way Jeri Ryan appears like would dream wood disheveled unhappy find final man alive well like Alan Anyway try co exist fail get drunk before creating ultimate dystopia run Redneck Raphael played newcomer Dan Montgomery Jr Bonds torn confusion set couple becomes third wheel battle physically inept nerd v brainless jock Even nobody left planet becomes truth even darkest human nature arise Using variable film technique Ralston give u mediocre story based loosely another film entitled The Quiet Earth I viewing next oddly never give credit towards With borrowed story I guess decent job reinterpreting His punch seems be lacking beginning Ralston try find stride borrowing yet film director technique attempt find own He open film interestingly enough fails answer direct answer Sure final day arrived could be concise answer better yet these select survived A spookier beginning would led u stronger a comical film The juxtaposition would been like Shawn Dead instead left u feeling like watching a made TV program Listening audio commentary I respect Ralston worked diligently get film made his passion nearly sell film you could tell his interaction cast he happy his overall final product There mistake one he pointed others he ashamed point While doe make decent independent film making sometimes feel cheap Ralston case latter I must admit David Arnott portrayal Alan hooked He played wimpy school nerd adult role well He funny both watch listen thus he became sympathetic the viewer He a key player keeping the film together ala I not say the same the rest This Dan Montgomery first film obvious I mean really really obvious There scene I thought the cue card about come read the line him perhaps even giving u a more realistic performance ala wasn the case Then Jeri Ryan She pulled character near the end the film the culmination the entire piece art She go estranged unknown bitter cranky insane girlfriend the end Confused Again fell her character the end giving u a glimpse could probably done her acting matured Even the commentary progressed contributed a laugh giggle ohhh look color moment While her beauty may sell ticket one may want consider knowledge to be beautiful This her first film I be too harsh Overall this film felt like missing something I though the idea strong the premise even only a peppering people remaining the Earth the evil human nature still exists Jealousy not be killed bacteria bomb maybe it consumed zinc we a race always want what we can not Ralston not a surprising director his technique flawed and pre used he doe know to make a low budget comedy I think idea funny different that is why I find laughing many the bit he found hysterical His actor provided the level acting needed this film wa lower average His film wa loose meaning that there were element never quite explained or tackled e anything with wing survived which overall harmed the intensity of the film This wa a comedy it could been much darker and much much funnier For thinking that Roger Avery wa a huge element to this film a we learn from their commentary he wa there wa money the wa in essence the bank The Last Man Don t get hope for any classic Avery moment Don t expect more from Ralston and that is how I end it Grade of,negative
703,I must admit I expecting something quite different my first viewing Cut last night though delighted unexpected Australian horror gem I true horror fan true come found Cut be best genre Australia ever produced one great parody comedy film late My concern mainstream audience may not pick on lot comedic element film not overly clever application made laugh every turn trying fit EVERY possible cliche horror genre they could I certain intended humour hoping intended humour And course the gore The use the customised garden shear wa brilliance besides the expected stab slash In short wa a huge amount variety creativity the many violent death enough please even the skeptic film worth The appearance Kylie Minogue short that her appearance wa and Molly Ringwald wa just another reason see the film both performance fantastic well Simon Bossell The Castle a brilliant role the jokey technician All all I think this movie one the best horror product the last couple year well a beautiful satire parody toungue cheek till the very end Loved Go see it,positive
704,I so happy live an American small town Because whenever I shown small town States is populated kind monster among flesh hungry zombie evil alien sinister ghost harmless In movie former doctor s done time an accidental killing wife car crash directs his step nearest small town must never his life seen flick any small town happens be Purgatory Flats And course soon he arrives the hell break loose He meet blond chick all creature most resembles cow facial expression in brain functioning at fall in love her But is tiny handicap is already married to small time drug dealer in a minute get shot pitifully dead To know ha come out all this should watch the movie yourself I just tell that s slightly reminiscent of U Turn Oliver Stone is a way in all artistic property,positive
705,Like anyone else bought I duped piece extreme gore banned country whatever say box I admit I huge gore fan I always amazed film lay thick look convincing Tom Savini Rick Baker Greg Cannom some best business The revolutionized make effect Today need everything done computer But computer compare visual wizardry these three men could conjure But I digress Watching fantastically gory film like Fulci Gates Hell even Savini crowning achievement Friday th the Final Chapter appreciate go making terrifically gory film You tell the difference reality magic I can t imagine another reason anyone would see Cannibal Ferox the gore ostensibly omnipotent film If the reason seek film wasting money As many reviewer noted the gore an aftermath You don t see the torture the bloodshed happens see whatever look like afterwords The gore Well s here not a much a one would hope expect A man get castrated woman get hanged her breast other those two scene one involving scalping is nothing really much else film The scene gore even these three mentioned still pretty tame comparison what were hoping Maybe it s my sick twisted experience the horror gore genre I expecting a bit Call me sick twisted but isn t that the only reason people watching this film the first place I honestly found bored a lot place Cannibal Ferox is just another film that try capitalize on a craze of a superior film While Cannibal Holocaust is not exactly a great film it is much better this tripe If go of way to buy this for you will feel cheated,negative
706,I always felt Ms Merkerson never gotten role fitting skill Familiar million Lt Law Order ha seen number theatrical release always supporting role HBO Lackawanna Blues change allows talented actress shine Nanny successful entrepreneur a world changing segregation integration But story really the colorful array character she her adopted son meet a boarding house Lackawanna New York a suburb Buffalo The story could set any major African American community the and from Atlanta Sweet Auburn New York Harlem But the segregation integration angle only a subtle undercurrent the colorful life the folk Nanny boarding house The story revolves around Nanny relationship all kind people played some the best actor the business I purposely not say black actor ensemble a stunning array talent happen be black except Jimmy Smits course I recommend film a fun and colorful look a bygone day,positive
707,This not likely voted best comedy year many coincidence plot hole However talking movie hit man white bread salesman become buddy few vagary t come too much surprise Brosnan excellent role gone the wooden James Bond a role wa wasted If maintain this kind quality I hope continues make comedy Greg Kinnear also excellent Brosnan straight man I read a few negative comment here Hope Davis I thought wa quite good a mousy housewife a dark side buried deep within There are lot good chuckle Brosnan sleaze way and a few scene I nearly died laughing My father a consultant nearly lost when Julian describes a a facilitator Much like Grosse Pointe Blank another hit man comedy the humour can be dark If are be prepared to enjoy,positive
708,As casual listener Rolling Stones I thought might interesting Not film very it age To someone born the look me hippy purist propaganda crap I sure this film not made me people were active th I expected drug galore th Stones I disappointed actually showed real life hard work the studio So much I felt a if I working them get conclusion this god awful film I not seen the director film I suspect follow similar style directing sort amatuerish gave a feeling like the TV show Eurotrash badly directed tackily put together lacking real entertainment value My good opinion of this that I t waste money it came free a Sunday paper,negative
709,Watch Original title This made TV movie god awful Although doe use far I tell almost same dialog just work Is acting poor directing OK made TV why watch bad copy get hand superb original Especially be spoiled plot won enjoy original much ve watched first There a thing different the original shorter once all are for the worse The actor playing the part just t fit the bill You just don t believe could top Edward G Robinsons performance the original If you want watch after you ve seen the original and even you be brave if you watch it through It s almost sacrilege,negative
710,Director Don Siegel really impressed film It starkly shot graphic without visually graphic well acted all concerned cover most taboo issue any day workmanlike almost expected normalcy hitherto seen any film reviewer I t know expect sitting watch this civil war movie kind soft core peddling with Eastwood descending school girl South But really neither those thing rather examination exploration descent soul men woman a dark commentary core civilized one reviewer previously noted none none character likable film end yet one interesting complex enigmatic Eastwood play Cpl McBurney a Union soldier found young Pamelyn Ferdin ll recognize voice soon you hear a girl at a school manner headed Geraldine Page amidst chaos wa the Civil War particularly the South Soon Page teacher Elizabeth Hartman lovely young seductress Carol even Ferdin Amy emotional sexual tie Eastwood having own need secret problem Eastwood not a nice man play the girl other always trying get the sexual advantage In the unfolding get some real interesting thing revealed latent lesbianism to incest The Beguiled me a masterpiece far exceeded expectation every creative front This might except Invasion the Body Snatchers Siegel best film It certainly one Eastwood s best REAL performance page always very good Hartman Fe rdin et al excellent the Gothic manse set the school effectively claustrophobic Some of the sexual laced scene disturbing And what happens to Eastwood is a leg on much of the competition creepy eerie demented film,positive
711,Anyone lived the age Revenge the Nerds Girlpower appreciate film It one those film delivers everything want spring break movie PLUS make fun the college film genre It funny s got cast die Amy Pohler Rachel Dratch Sophie Monk Parker Posey Jane Lynch Amber Tamblyn Missi Pyle it guaranteed make laugh loud Writer actor Rachel Dratch a comic genius Sophie Monk such a great villain Wilson Phillips OMG I just repeating now It live with girl like Miranda July feel like eating ice cream pretending re dumb,positive
712,Arguably finest serial ever made argument thus far Earthman Flash Gordon Professor Zarkov beautiful Dale Arden traveling rocket ship another universe save planet Along way spellbinding spectacular action packed chapter Flash his friend along new found friend Prince Barin Prince Thun awesome King Vultan pool resource together fight evil army merciless Ming Mongo jealous treachery his daughter Priness Aura she car This serial not cut serial term plot acting budget mile ahead these area Produced Universal Studios many former set it disposable like laboratory set The Bride Frankenstein Opera House The Phantom the Opera name few The production value across the board advanced most humble opinion The costume worn many these strange men woman really creative first rate We get hawk men shark men lion men high priest creature like dragon octasacks orangapoids tigrons oh my many many fantastic thing Are believable first rate special effect No way But most impressive The musical score awesome the chapter beginning well written lengthy enough revitalize viewer memory the former chapter expertly scored Director Frederick Stephani a great job piecing everything together wonderfully creating a worthy film Alex Raymond phenom comic strip Lastly the acting pretty good serial All often serial either name no talent surrounding one two former talent most everyone ha some ability Don get wrong this isn a Shakespeare troupe any mean Buster Crabbe a workmanlike likable job Flash He ably aided Jean Arden Priscella Lawson the rest the cast general two performer standing But I get those two let add another reviewer noted must been amazing this serial get the Hayes Office I see flesh Flash on Jean Rogers Priscella Lawson movie decade later The short Crabbe unfortunately all u Professor Zarkov Frank Shannon wear about form fitting a pair short guy wear The girl wearing mid drift throughout absolutely beautiful Jean Rogers may limited acting talent she a blonde bombshell Lawson also very sultry sensuous beautiful But me the two actor make the serial are Charles Middleton a Ming officious sardonic merciless fun Middleton a class act Jack Tiny Lipson play King Vultan boisterous rousing hilarious a symbol pure joy life the every essence hedonism Lipson steal every scene is in The plot meander there and everywhere Flash Gordon is the penultimate serial space opera and the basis load of science fiction to follow Excellent,positive
713,I say event didn hit until I saw documentary It took year come grip devastation I one changing the station the radio channel TV there any talk the tower I sick hearing When aired TV a year a day later I bawling eye It wa the first time I cried since the attack I highly recommend documentary I watching it now TV year later I still cry the tragedy The fact this contains one the video shot the first plane hitting the tower amazing It wa an accident look it got These two brother make want have there to help,positive
714,Perfect movie rare Even favorite film tend flaw Rear Window look little stagey time Chris Elliot character Groundhog Day t work music score Best Years Our Lives cheesy beginning Nights Cabiria a little slow this film perfectly executed start finish The script brilliant acting superb around although Reese Witherspoon Sam Waterston amazing whole cast shine directing the photography inspired the music score touching without intrusive like Miramax score too manipulative Every sad moment truly moving every light moment make smile This truly one the best film I have ever seen I wish were film like I glad Reese Witherspoon gone stardom this film I sorry to see her recent movie are so much escapist silly this serious film is real people real feeling real problem Brilliant A must see,positive
715,This one worst movie ever made The plot looked intriguing like Passenger But latter movie somehow worked lot better The plot been worked worst possible way Just awful moment movie A flight attendant standing opened doorway a flying trying close door without sucked by the mile per hour wind Thereafter the land the aircraft a few mile starting foot thats impossible even pilot thousand hour experience When the runway perfectly straight course instructed pull the flap HUH Come flap there ensure lift low speed the runway use thrust reverse the engine give maximum power I go on about little and mostly big mistake in the movie then reply would become the size of the English dictionary This is a movie want to miss take word it,negative
716,regardless what anyone say b movie effect poorly done vampire fanatic I suppose would OK you others cant sincerely mean we view movie read a book effect character important well a story The story good carry film wonder ha a low rating all I write because I chose see movie I saw good review on IMDb got severely disappointed t get wrong I thought blade movie awesome loved underworld movie character t close the make on the vampire poorly done the effect worse suck I might gotten disappointed I not read review that told how great it wa the reviewer must have had something to do the production company something seriously you think this awesome you don t care acting make this is better a a book out of an OK story,negative
717,I want much believe quote specifically English subtitle translation actually written spoken rejection letter publisher sends protagonist meant self referential tongue cheek manner But director Leos Carax apparently neglected inform actor true nature film They all so dreadfully earnest their portrayal I conclude Carax actually take seriously or else so much disdain everyone especially viewing audience he bothered letting anyone joke Some auteur able get away making oblique bizarre film they so élan unique personal style e g David Lynch Alejandro Jodorowsky Others use subtler approach still weaving surreal element fabric story e g Krzysztof Kieslowski David Cronenberg later le bizarre work In Pola X Carax throw disjointed mess viewer then dare find fault Well it pacing erratic choppy particular continuity often dispensed superfluous character abound e g Gypsy mother child the performance overwrought the lighting often poor particularly the oft discussed sex scene unconnected scene thrust the film discernible reason the list go on Not be completely negative it should be noted there some uplifting exception I liked the musical score even the cacophonous industrial techno music played the sprawling abandoned complex to which the main character retreat the second half the film perhaps a reference to Andy Warhol Factory the Much the photography the countryside beautiful obvious attempt contrast the grimy city setting And even well middle age Cathering Deneuve show she still it Her performance also the only one among the major character didn t sink bathos There wa an earlier time I would regard film Pola X charitably Experimentation admirable even the experiment t work But Carax try nothing new the film a pastiche element borrowed countless earlier film after several decade movie viewing literally thousand film later I simply no longer the patience kind unoriginal poorly crafted tripe At this early moment the st century one left asking With the exception of Jean Pierre Jeunet there director France know to make a watchable movie anymore Rating,negative
718,It hard praise film much The CGI dragon well done lacked proper modelling light shadow Also the same footage used endlessly the dragon stomping corridor becomes slightly tedious I amazed see Marcus Aurelius the acting credit wondering an ex Emperor the Roman Empire doing acting film Like Whoopie Goldberg must an alias can one blame for using one he appears this stinker The story might interesting the acting flat direction tedious If MUST watch this film go around your friend house get drunk doing then ll enjoyable,negative
719,I remember going see movie summer parent being pretty time Of course I seven time Right Jackson movie came my wife I rented movie since had never seen I feeling nostalgic Ralph Bakshi ran money mid way animation process movie forced drastically cut corner production Since this movie done primarily rotoscoping the animation technique people budget this saying something Much this movie animation the loosest sense the word There scene are very obviously people standing front screen maybe some animation effect superimposed top them Because budget constraint the movie already compression The Fellowship the Rings and part The Two Towers pared even What get sort like film strip version the Cliff Notes of the book Its all bad though the animation brings warmth it I found lacking in the Jackson movie Its nice imagine it could been like with decent funding This movie also noteworthy having the sequel never came Several year later a half hearted half hour long TV special wa aired wa meant wrap thing All I say that is that it wa a musical,negative
720,Just finished watching FTM The trailer intrigued so much I actually went see opening weekend something I never Needless say I disappointed The story so much potential frustrating see get screwed I really feel problem movie directing Matthew McConaughey First I not MM hater I thought awesome both Reign Fire Lone Star I enjoyed performance movie without see shirt time Yes all get good looking guy nice body I think people knew year ago came on scene A Time Kill Showing shirt pumping iron like sweaty madman time the movie totally unnecessary I think one time would been sufficient It t surprise threw those unnecessary scene so girlfriend wife would willing tag along their significant woman want see movie sport gambling unless Enough let get role I feel acting very forced t seem very comfortable I know character supposed charming southerner line corny cheesy It almost like referencing Days Confused line few time In short I t like his character even though I supposed The accent his shirt corny pick line weak sale pitch His character wa much a tool Brandon Jonathan Pacino Assante great that no surprise Piven fun watch Arie oooops I mean Jerry I just feel movie wa very commercial put together poorly It insulting that they could take a great story throw crap ingredient try make it a box office success Cool story that appeal the male man Hunky Hollywood actor female woman make sure he ha numerous scene shirt lifting weight Al Pacino with great speech scene great one liner Every character shall dressed thousand dollar suite have extremely dark tan Jeremy Piven play the same character he did Entourage Old School Throw Armand Assante seal the deal Plot good writing character development intelligent casting unnecessary This good enough most people not Anybody disagrees with me ask self Would movie be much better if A Directed Sodeberg B DeCaprio Ed Norton Brandon instead MM I probably be part the minority thinking movie suck I realized when the woman next to me started cry the ridiculous ending scene Pacino shedding a fake tear embracing Russo The financial success this movie ensure one thing The movie going public get the movie going public want big budget crapola,negative
721,I watching sci fi channel steaming pile crap came While bad Wynorski Curse Komodo still suck BAD Wynorski us island Curse Komodo well a the same actor house The effect top notch suprising thats it I t know else say movie oh yeah As in Curse the Komodo the government get involved decides bomb the island Also saw this part i laughed hysterically A KOMANBRA part man komodo AND cobra Overall this movie utter crap even bad movie standard Just remember Jim Wynorski anything do a movie steer clear avoid falling asleep keep repeating It almost it almost out,negative
722,I heard Driving Lessons ITV advert honest I t know much I would like I switched TV last night totally surprised Driving Lessons a modest simple film draw right start Rupert Grint play part socially awkward teenager Ben brilliantly He definitely one look in the future Dame Eve Walton played the fabulous Julie Walters I loved the simple plot the way the actor portrayed character great sensitivity The highlight the film for me Evie rather colourful poem It show friendship form the unlikely pair In opinion watching Driving Lessons a great way to spend hour The scenery wa also striking especially the countryside Anyone can call sparkling comedy forgettable I strongly disagree,positive
