,review,sentiment
0,One reviewer mentioned after watching Oz episode ll hooked They right this exactly happened The first thing struck about Oz it brutality unflinching scene violence set right word GO Trust this not show the faint hearted timid This show pull punch regard drug sex violence Its hardcore the classic use the word It called OZ the nickname given the Oswald Maximum Security State Penitentary It focus mainly Emerald City experimental section the prison all the cell glass front face inwards privacy not high the agenda Em City home many Aryans Muslims gangsta Latinos Christians Italians Irish scuffle death stare dodgy dealing shady agreement never far away I would say the main appeal the show due the fact that go other show t dare Forget pretty picture painted mainstream audience forget charm forget romance OZ t mess around The first episode I ever saw struck me a nasty it surreal I t say I wa ready it a I watched more I developed taste Oz got accustomed the high level graphic violence Not violence injustice crooked guard ll sold for nickel inmate ll kill order get away it well mannered middle class inmate turned prison bitch due their lack street skill prison experience Watching Oz may become comfortable what uncomfortable viewing thats you get touch your darker side,positive
1,A wonderful little production The filming technique unassuming very old time BBC fashion give comforting sometimes discomforting sense realism entire piece The actor extremely well chosen Michael Sheen only got polari he all voice pat You truly see seamless editing guided reference Williams diary entry only it well worth the watching it a terrificly written performed piece A masterful production one the great master comedy his life The realism really come home the little thing the fantasy the guard rather use the traditional dream technique remains solid disappears It play our knowledge our sens particularly the scene concerning Orton Halliwell the set particularly of their flat Halliwell mural decorating every surface terribly well done,positive
2,I thought wonderful way spend time hot summer weekend sitting air conditioned theater watching light hearted comedy The plot simplistic dialogue witty the character likable even the well bread suspected serial killer While may disappointed they realize Match Point Risk Addiction I thought proof Woody Allen is still fully control the style many u grown love This wa the I laughed one Woody comedy year dare I say decade While I never impressed Scarlet Johanson this managed tone her sexy image jumped right a average spirited young woman This may be the crown jewel his career it wa wittier Devil Wears Prada more interesting Superman a great comedy go see friend,positive
3,Basically s family little boy Jake think s zombie closet his parent fighting time This movie slower soap opera suddenly Jake decides become Rambo kill zombie OK first going make film you must Decide it thriller drama As a drama movie watchable Parents divorcing arguing like real life And we Jake his closet totally ruin all the film I expected see a BOOGEYMAN similar movie instead watched a drama some meaningless thriller spot of the well playing parent descent dialog As for the shot Jake ignore,negative
4,Petter Mattei Love Time Money visually stunning film watch Mr Mattei offer u a vivid portrait human relation This a movie seems be telling u money power success people different situation encounter This a variation Arthur Schnitzler play theme director transfer the action the present time New York different character meet connect Each one connected one way another the next person no one seems know the previous point contact Stylishly the film a sophisticated luxurious look We taken to see people live the world live their habitat The thing one get all these soul the picture the different stage loneliness one inhabits A big city not exactly the best place which human relation find sincere fulfillment one discerns the case most the people encounter The acting good Mr Mattei direction Steve Buscemi Rosario Dawson Carol Kane Michael Imperioli Adrian Grenier the rest of the talented cast make these character come alive We wish Mr Mattei good luck await anxiously his next work,positive
5,Probably time favorite movie story selflessness sacrifice dedication a noble cause not preachy boring It never get old despite having seen it some time last year Paul Lukas performance brings tear my eye Bette Davis one few truly sympathetic role a delight The kid a grandma say more like dressed midget child that make more fun watch And the mother slow awakening what happening the world under her own roof believable startling If I a dozen thumb d all be for movie,positive
6,I sure would like see resurrection dated Seahunt series tech today would bring back the kid excitement I grew on black white TV Seahunt Gunsmoke hero every week You have my vote a comeback a new sea hunt We need a change pace TV would work a world under water adventure Oh the way thank for outlet like view many viewpoint TV the many movie So ole way I believe I got I wan na say Would nice read more plus point sea hunt If my rhyme would line would let submit leave out to be doubt have me to quit If this is then I must go let it,positive
7,This show an amazing fresh innovative idea when first aired The first year brilliant thing dropped after By show not really funny anymore continued decline complete waste time today It truly disgraceful far show fallen The writing painfully bad performance almost bad not mildly entertaining respite guest host show probably t still the air I find so hard believe the creator hand selected the original cast also chose the band hack followed How one recognize brilliance then see fit to replace with mediocrity I felt I must give star of respect the original cast made show a huge success As is the show is just awful I t believe it s still on the air,negative
8,Encouraged positive comment film here I looking forward watching film Bad mistake I seen film this truly one worst them awful almost every way editing pacing storyline acting soundtrack the film s song lame country tune played le four time The film look cheap nasty boring the extreme Rarely I so happy see the end credit film The thing prevents giving this a score Harvey Keitel this is far his best performance at least seems be making a bit an effort One Keitel obsessive only,negative
9,If like original gut wrenching laughter like movie If are young old you will love movie hell even mom liked Great Camp,positive
10,Phil Alien one those quirky film humour based around oddness everything rather actual punchlines At first wa odd pretty funny a movie progressed I t find the joke oddness funny anymore Its low budget film thats never problem itself were pretty interesting character eventually I lost interest I imagine film would appeal a stoner is currently partaking For something similar better try Brother another planet,negative
11,I saw movie I came I recall scariest scene big bird eating men dangling helplessly parachute right air The horror The horror As young kid going these cheesy B film Saturday afternoon I still tired the formula these monster type movie usually included the hero beautiful woman might the daughter of a professor a happy resolution the monster died the end I t care much the romantic angle a year old the predictable plot I love now the unintentional humor But about a year so later I saw Psycho it came I loved the star Janet Leigh bumped early the film I sat and took notice that point Since screenwriter making the story make it up be scary possible and not a well worn formula There no rule,negative
12,So im big fan Boll work many I enjoyed movie Postal maybe im one Boll apparently bought right use Far Cry long ago even game even finsished People enjoyed killing mercs infiltrating secret research lab located tropical island be warned Far Cry This something Mr Boll schemed together along legion schmuck Feeling loneley set Mr Boll invite three his countryman play These player go name Til Schweiger Udo Kier Ralf Moeller Three name actually made self pretty big movie biz So tale go like Jack Carver played Til Schweiger yes Carver German hail bratwurst eating dude However I find Tils acting this movie pretty badass People have complained how s not really staying true whole Carver agenda only saw carver first person perspective we t really know looked like he wa kicking a However the storyline this film beyond demented We see the evil mad scientist Dr Krieger played Udo Kier making Genetically Mutated soldier GMS they called Performing his top secret research an island reminds SPOILER Vancouver reason Thats right palm tree Instead we got nice rich lumberjack wood We t even gone FAR I started CRY mehehe I not go any If wan na stay true Bolls shenanigan then go see this movie will not be disappointed delivers the true Boll experience meaning will suck There some thing worth mentioning would imply Boll a good work some area of the film a some nice boat fighting scene Until the whole cromed albino GMS squad enters the scene everything make laugh The movie Far Cry reek of scheisse s poop simpleton a fa r you wan na take a wiff go ahead BTW Carver get a very annoying sidekick make you wan na shoot the first three minute he s screen,negative
13,The cast played Shakespeare Shakespeare lost I appreciate this trying bring Shakespeare the mass why ruin something good Is because The Scottish Play favorite Shakespeare I know What I know certain Rev Bowdler hence bowdlerization tried do something similar the Victorian era In word can improve perfection I no to write I to write least ten line text English composition never my forte I to keep going say that this movie a the saying go just doe not cut,negative
14,This fantastic movie three prisoner become famous One the actor george clooney I not fan roll not bad Another good thing the movie the soundtrack The man constant sorrow I recommand this movie everybody Greetings Bart,positive
15,Kind drawn by erotic scene realize one amateurish unbelievable bit film I ever seen Sort like high school film project What Rosanna Arquette thinking And wa all stock character bizarre supposed Midwest town Pretty hard get involved one No lesson to be learned brilliant insight stilted quite ridiculous lot skin that intrigue videotaped nonsense What wa bisexual relationship nowhere all the heterosexual encounter And wa that absurd dance with everybody playing stereotyped role Give this one pas it s like million mile of bad wasted film money that could been spent starving child Aids Africa,negative
16,Some film simply not remade This one them In not bad film But fails capture flavor terror film title Liam Neeson excellent he always cast hold exception Owen Wilson just not bring right feel the character Luke But the major fault with this version it strayed far the Shirley Jackson story it attempt be grandiose lost of the thrill of the earlier film trade for snazzier special effect Again I say that and of it not a bad film But will enjoy the friction of terror in the older version much,positive
17,This movie made into one my top awful movie Horrible There continuous minute there t fight one monster another There no chance any character development busy running one sword fight another I no emotional attachment except big bad machine wanted destroy Scenes were blatantly stolen other movie LOTR Star Wars Matrix Examples The ghost scene end stolen final scene old Star Wars Yoda Obee One Vader The spider machine beginning exactly like Frodo attacked the spider Return the Kings Elijah Wood the victim both film wait hypnotizes sting victim wrap up uh hello And the whole machine v human theme WAS the Matrix Terminator There more example why waste the time And someone tell what with the Nazi Nazi There a juvenile story line rushed a juvenile conclusion The movie could decide it a child movie an adult movie wasn t much either Just awful A real disappointment say the least Save money,negative
18,I remember film first film had watched cinema picture wa dark place wa nervous wa back my Dad took my brother sister Newbury cinema Newbury Berkshire England I recall tiger the lot snow the film also the appearance Grizzly Adams actor Dan Haggery think one the tiger get shot dy If anyone know find on DVD etc please let know The cinema ha turned fitness club is a very big shame the nearest cinema is mile away would love to hear others have seen film any like,positive
19,An awful film It must been against real stinker be nominated Golden Globe They taken story first famous female Renaissance painter mangled beyond recognition My complaint not they taken liberty fact the story good would perfectly fine But simply bizarre all account the true story artist would made a far better film why they come this dishwater dull script I suppose weren enough naked people the factual version It hurriedly capped in the end a summary the artist s life could saved a couple hour they favored the rest the film with same brevity,negative
20,After success Die Hard sequel surprise really glut Die Hard movie cashed wrong guy wrong place wrong time concept That what did Cliffhanger Die Hard mountain time rescue Sly Stop My Mom Will Shoot Stallone career Cliffhanger one big nit picker dream especially those are expert mountain climbing base jumping aviation facial expression acting skill All s full excuse dismiss film one overblown pile junk Stallone even managed get acted horse However forget all nonsense it s actually a very lovable undeniably entertaining romp delivers plenty thrill unintentionally plenty laugh You got love John Lithgows sneery evilness tick every box band baddie best all permanently harassed hapless turncoat agent Rex Linn Travers He may been Henry in Portrait a Serial Killer Michael Rooker noteworthy a cringe worthy performance Hal insists on constantly shrieking in painful disbelief his captor man never hurt anybody And whilst surely it really look like Ralph Waite s Frank character grinning girl plummet her death Mention must go former London s Burning actor Craig Fairbrass the Brit bad guy come a cropper whilst using Hal a Human Football yes you can t help enjoy bit Hal needed a good kicking So forget better judgement care that could never happen lower acting expectation turn the volume enjoy And you looking Qaulen s the one wearing the helicopter,positive
21,I terrible misfortune having view b movie entirety All I say save time money This got worst b movie time shouldn even be called b movie like f movie Because fails all aspect make good movie story not interesting all all actor paper thin not all believable ha bad direction action sequence so fake it s almost funny almost The movie just packed full of crappy one liner no respectable person could find amusing least little bit This movie supposed be geared towards men all the woman it SO utterly unattractive especially old wrinkled thing come towards the end They try appear sexy those weird horrible costume they fail miserably Even of the most ridiculous b movie still give some laugh this just painful to watch,negative
22,What absolutely stunning movie hr kill watch regret too much fun Rajnikanth carry movie his shoulder although isn t anything other him I still liked The music A R Rehman take time grow you after you heard a time you really start liking it,positive
23,First let get thing straight I AM anime fan always been matter fact I used watch Speed Racer all time Preschool b I DO like several B Movies they hilarious c I like Godzilla movie lot Moving when movie first come seems like s going be usual B movie crappy FX all sudden BOOM anime come This when movie go WWWAAAAAYYYYY downhill The animation VERY bad cheap even worse what I remember SPEED RACER crissakes In fact s cheap one few scene movie I vividly remember when bunch kid run school s kid over The FX terrible dinosaur look worse Godzilla In addition transition live action animation unorganized dialogue voice especially English dub I viewed horrid I begging dad take tape DVD VHS player The thing kept surviving cracking joke comment like the robot Joel Mike MST K pick the season Honestly is the only way barely enjoy movie survive the same time Heck I planning show another fellow otaku pal of mine Halloween a B Movie night Because s stupid pretty painful watch unintentionally hilarious at the same time I giving movie a an improvement the I originally going give it According my grading scale mean Pretty much boring bad As fun counting three unless find a way to make fun of it it become fun counting to,negative
24,This worst movie I saw WorldFest also received the least amount applause afterwards I only think it receiving recognition based the amount known actor the film It great see J Beals she only the movie minute M Parker much better actress the part allowed The rest the acting hard judge the movie so ridiculous predictable The main character totally unsympathetic therefore a bore watch There is no real emotional depth the story A movie revolving an actor can get work t feel original me Nor the development the cop It feel like one many straight video movie I saw back the And even a good one those standard,negative
25,The Karen Carpenter Story show little about singer Karen Carpenter complex life Though fails giving accurate fact detail Cynthia Gibb portrays Karen not fine election She good actress play very naive sort dumb Karen Carpenter I think role needed stronger character Someone a stronger personality Louise Fletcher role Agnes Carpenter terrific doe a great job Karen mother It great song could been included a soundtrack album Unfortunately weren though movie on the top the rating USA other several country,positive
26,The Cell an exotic masterpiece dizzying trip vast mind serial killer also one talented director This conclusive evidence achieved human being unleash uninhibited imagination This boldness work pushing aside thought fall formula cliche creating something truly magnificent This best movie year date I read numerous complaint film anywhere style no substance poorly cast character bad acting To negatively criticize film miss point This movie may landmark tradition future movie hopefully follow The Cell just opened door another world imagination So slam door face tell it director Tarsem Singh t want Personally I would more welcome another movie Tarsem would love see someone try challenge We all heard talk going inside mind serial killer yes I agree genre bit overworked The were full movie trying depict make serial killer tick worked failed But The Cell not blaze trail we given new twist we are physically transported the mind presented nothing le than a fascinating journey the most mysterious subject matter ever studied I like the movie not bog u much scientific jargon trying explain Jennifer Lopez actually get enter the brain another Instead just lie on a laboratory table is wrapped look like really long Twizzlers jaunted another entity The Cell want let see all not all about I guess s some people t like True I like explanation my movie a movie venture onto new ground must let do what desire simply take I noticed the film dark it showed reality maybe contrast the bright visuals when inside the brain another Nonetheless the set design simply astonishing I t be surprised this film took home a few Oscars in cinematography best costume best director the like If it were to it at least get nominated best picture I noticed I kind been repeating Not there s nothing else to say because I t stress enough how fantastic I thought The Cell If walk the movie with a very open mind to it taken with wonder and an eye popping feast you are assured a good time I guess this film just a little much some people writing it off weird crazy I very much psychology and the imagination the human mind it right my alley Leaving the theater I heard one audience member say Whoever made movie sure a lot of good drug If I want what he smoking of,positive
27,This film tried be many thing stinging political satire Hollywood blockbuster sappy romantic comedy family value promo list go It failed miserably all them there enough interest keep from turning off end Although I appreciate spirit behind WAR INC depresses see clumsy effort especially it be taken it target reflect lack existence a serious critique rather simply the poor writing direction and production this particular film There a critique to be made the corporatization war But poking fun at it this way diminishes the true atrocity what happening Reminds a bit THREE KINGS similarly trivializes a genuine cause concern,negative
28,This movie so frustrating Everything seemed energetic I totally prepared have good time I least thought I be able stand But I wrong First weird looping It like watching America Funniest Home Videos The damn parent I hated so much The stereo typical Latino family I need speak person responsible this We need have talk That little girl wa always hanging someone I hated to mention Now the final scene transcends I must say It so gloriously bad full badness it a movie it What crappy dancing Horrible and beautiful once,negative
29,War movie Hollywood genre done redone many time clichéd dialogue rehashed plot over top action sequence seem unavoidable any conflict dealing large scale combat Once however war movie come along go grain brings truly original compelling story life silver screen The Civil War era Cold Mountain starring Jude Law Nicole Kidman Renée Zellweger such film Then calling Cold Mountain war movie entirely accurate True enough film open quite literally quick dirty battle sequence put Glory director Edward Zwick shame However Cold Mountain much Civil War period people time The story center around disgruntled Confederate soldier Inman played Jude Law becomes disgusted gruesome war homesick beautiful hamlet Cold Mountain North Carolina equally beautiful southern belle left behind Ada Monroe played Nicole Kidman At first glance setup appears formulaic romantic interest back home give audience enough sympathy root reluctant soldier tribulation battlefield Indeed the earlier segment the film relatively unimpressive even somewhat contrived Cold Mountain soon take a drastic turn though the intrepid hero Inman turn a deserter incidentally saving the audience the potentially confusing scenario wanting root the Confederates begin a long odyssey homeward Meanwhile back the farm Ada cultured way prove little use the field soon transformed something a wilderbeast Coming Ada rescue the course tough nail Ruby Thewes played Renée Zellweger help Ada put the farm back together perhaps importantly cope the loneliness isolation the war seems brought upon Ada Within two setting a vivid compelling at time disturbing portrait the war torn South unfolds The character whom Inman Ada interact surprisingly complex enhanced wonderful performance Brendan Gleeson Ruby deadbeat father Ray Winstone an unrepentant southern lawman Natalie Portman a deeply troubled isolated young mother All have been greatly affected changed the war Northern aggression mostly the worse The dark pervading anti war message accented an effective haunting score chillingly beautiful shot Virginia North Carolina communicated the audience not so much gruesome battle scene a the scarred land traumatized people which the war fought Though the weapon tactic war have changed much the past century s hellish effect the land timelessly relevant Director Anthony Minghella manages maintain gloomy mood most the film the atmosphere unfortunately denigrated a rather tepid climax doe little justice the wonderfully formed character The love story Inman Ada is awkwardly tacked onto the beginning end the film though the inherently distant abstracted even absurd nature their relationship a way fit the dismal nature the rest the plot Make mistake Cold Mountain ha neither the trait a feel good romance an inspiring war drama It is a unique vision an era is sure not only entertain also truly absorb the audience the life a people torn apart by a war entirely desperate to be rid it terrible repercussion altogether,positive
